{
 "version": 1,
 "walls": [
  {
   "id": "wall-n",
   "dimensions": [
    3.5,
    2.7,
    0
   ],
   "transform": [
    [
     1.0,
     0,
     0.0,
     0
    ],
    [
     0,
     1,
     0,
     0.030000000000000027
    ],
    [
     -0.0,
     0,
     1.0,
     -2.0
    ],
    [
     0,
     0,
     0,
     1
    ]
   ],
   "confidence": "high"
  },
  {
   "id": "wall-s",
   "dimensions": [
    3.5,
    2.7,
    0
   ],
   "transform": [
    [
     -1.0,
     0,
     0.0,
     0
    ],
    [
     0,
     1,
     0,
     0.030000000000000027
    ],
    [
     -0.0,
     0,
     -1.0,
     2.0
    ],
    [
     0,
     0,
     0,
     1
    ]
   ],
   "confidence": "high"
  },
  {
   "id": "wall-e",
   "dimensions": [
    4.0,
    2.7,
    0
   ],
   "transform": [
    [
     0.0,
     0,
     -1.0,
     1.75
    ],
    [
     0,
     1,
     0,
     0.030000000000000027
    ],
    [
     1.0,
     0,
     0.0,
     0
    ],
    [
     0,
     0,
     0,
     1
    ]
   ],
   "confidence": "high"
  },
  {
   "id": "wall-w",
   "dimensions": [
    4.0,
    2.7,
    0
   ],
   "transform": [
    [
     0.0,
     0,
     1.0,
     -1.75
    ],
    [
     0,
     1,
     0,
     0.030000000000000027
    ],
    [
     -1.0,
     0,
     0.0,
     0
    ],
    [
     0,
     0,
     0,
     1
    ]
   ],
   "confidence": "medium"
  }
 ],
 "floors": [
  {
   "id": "floor-0",
   "dimensions": [
    3.5,
    4.0,
    0
   ],
   "transform": [
    [
     1,
     0,
     0,
     0
    ],
    [
     0,
     0,
     1,
     -1.32
    ],
    [
     0,
     -1,
     0,
     0
    ],
    [
     0,
     0,
     0,
     1
    ]
   ],
   "confidence": "high"
  }
 ],
 "doors": [
  {
   "id": "door-0",
   "parent": "wall-s",
   "dimensions": [
    0.9,
    2.05,
    0
   ],
   "transform": [
    [
     -1.0,
     0,
     0.0,
     1.0
    ],
    [
     0,
     1,
     0,
     -0.29500000000000015
    ],
    [
     -0.0,
     0,
     -1.0,
     2.0
    ],
    [
     0,
     0,
     0,
     1
    ]
   ],
   "confidence": "high"
  }
 ],
 "windows": [
  {
   "id": "window-0",
   "parent": "wall-n",
   "dimensions": [
    1.4,
    1.3,
    0
   ],
   "transform": [
    [
     1.0,
     0,
     0.0,
     -0.3
    ],
    [
     0,
     1,
     0,
     0.22999999999999998
    ],
    [
     -0.0,
     0,
     1.0,
     -2.0
    ],
    [
     0,
     0,
     0,
     1
    ]
   ],
   "confidence": "high"
  }
 ],
 "openings": [],
 "objects": [
  {
   "id": "object-0",
   "category": "table",
   "dimensions": [
    1.2,
    0.75,
    0.7
   ],
   "transform": [
    [
     1.0,
     0,
     0.0,
     0.4
    ],
    [
     0,
     1,
     0,
     -0.9450000000000001
    ],
    [
     -0.0,
     0,
     1.0,
     -0.8
    ],
    [
     0,
     0,
     0,
     1
    ]
   ],
   "confidence": "medium"
  }
 ]
}
